<<uiDirective>>	"!style":<<text>>	"style":<<text>>	load preferred style template; use "!style" to specify preferred spacing, fonts, colors, background images, sound-effects, sprite animation, and other aspects of aesthetic appeal in human-centric UI (i.e., features that would not be needed for computational agents to correctly determine UI functionality); <<text>> is likely a set of CSS rules or a URL of a style-sheet, though it may contain other styling resource specific to a given UI software framework (e.g. javascript); "!style" directive may be called multiple times to load multiple parts of a style template	
<<uiDirective>>	"!time":<<ums>>	"T":<<ums>>	time scheduling for current declaration/update; used to delay the processing of the current update until user time has reached the specified <<ums>>; scheduling commands are processed first, before any other commands/properties in current <<pList>>, and are executed in the following order: "T", "Tr", "Td", "Ti"	Ex: {"Q":[{"T":1000,"A":["hello"]},{"T":2000,"A":["world"]}]} will add the text "hello" to display exactly 1.0s after handshake was sent, and then add the text "world" exactly 2.0s after handshake was sent
<<uiDirective>>	"!trigger":{(<<userPropTrigger>>(,(<<userPropTrigger>>)*)?}	"Tr":{(<<userPropTrigger>>(,(<<userPropTrigger>>)*)?}	trigger rule for current update; current update/declaration is triggered whenever UI->APP message matches the specified <<userProp>>'s; use "Tr":{} as a wildcard to trigger whenever any UI->APP message is sent; use "Tr":{...<<userPropName>>:{}...} as a wildcard to trigger whenever a UI->APP message includes <<pName>>, regardless of its corresponding value; use "Tr":{..."u":null...} to set up a trigger for root container events; scheduling/trigger commands are processed first, before any other commands/properties in current <<pList>>, and are executed in the following order: "T", "Tr", "Td", "Ti"	Ex: {"Tr":{"v":true},"in":-1} will disable all display interactions whenever any button is clicked (useful to prevent accidental repeat-clicks in asynchronous tasks); Ex: {"Tr":{"u":"Submit","v":true},"A":[{"c":"win","id":"Loading...","mod":1}]} will bring up a "Loading..." popup window when user clicks the "Submit" button
<<Command>>	"!timeDelay":<<number>>	"Td":<<number>>	timed delay (i.e., timeout) prior to update; <<number>> is the number of seconds (according to user-agent clock) to delay; scheduling commands are processed first, before any other commands/properties in current <<pList>>, and are executed in the following order: "T", "Tr", "Td", "Ti"	Ex: APP->UI message {"A":[{"v":"hello","Q":[{"Td":2,"v":null}]}]} would add text "hello" to screen, and then remove it 2 seconds later
<<Command>>	"!timeInterval":<<number>>	"Ti":<<number>>	time interval for current update; <<number>> is the number of seconds (according to user-agent clock) to delay between update executions; if <<number>> is less than UI refresh rate, interval will fire at the speed of UI refresh rate; scheduling commands are processed first, before any other commands/properties in current <<pList>>, and are executed in the following order: "T", "Tr", "Td", "Ti"; "Ti" does not cause a delay before initial update (use "Td" to add that delay)	Ex: APP->UI message {"Ti":2,"Tn":"polling","R":[]} will execute the "R" command immediately (sending a UI->APP message {"t":<<ums>>,"r":{}}), and then again every two seconds until/unless "Tc":"polling" or "Tc":{} <<uiDirective>> is found in a future update
<<Command>>	"!timingName":<<text>>	"Tn":<<text>>	timer or trigger name; naming an update scheduled via "T", "Tr", "Td", and/or "Ti" commands enables its later cancellation via <<uiDirective>> "Tc":<<text>>	Ex: APP->UI message {"v":[{"id":"candles","v":0,"Q":[{"Td":10,"v":1,"Tn":"t1"},{"Td":20,"v":2,"Tn":"t2"}]}]} would add item "candles" with value 0 to display, and set up named timers to change the value of "candles" to 1 after 10sec and to 2 after 20sec, such that a follow-up APP->UI message {"Tc":"t1"} would cancel the update scheduled to occur in 10s and {"Tc":"t2"} would cancel the update scheduled to occur in 20s (APP->UI message {"Tc":{}} would cancel all scheduled updates regardless of name)
<<uiDirective>>	"!timingCancel":<<text>>	"Tc":<<text>>	cancel named scheduled updates; <<text>> is the name of the update, as specified via "Tn" <<Command>>	Ex: APP->UI message {"v":[{"id":"candles","v":0,"Q":[{"Td":10,"v":1,"Tn":"t1"},{"Td":20,"v":2,"Tn":"t2"}]}]} would add item "candles" with value 0 to display, and set up named timers to change the value of "candles" to 1 after 10sec and to 2 after 20sec, such that a follow-up APP->UI message {"Tc":"t1"} would cancel the update scheduled to occur in 10s and {"Tc":"t2"} would cancel the update scheduled to occur in 20s
<<uiDirective>>	"!timingCancel":{}	"Tc":{}	cancel all updates scheduled via "T", "Tr", "Td", and "Ti" commands (regardless whether they were named)	
<<Command>>	"!updateChildren":{(<<matchByVal>>(,<<matchByVal>>)*)?}	"U\*":{(<<matchByVal>>(,<<matchByVal>>)*)?}	update multiple child items of current container; this <<Command>> is only valid for container-type items; select all items that match all <<matchByVal>>'s in current container and update them according to current property specifications; update commands are processed in the following order: "U", then "U**", then "U*", and these are processed after scheduling commands (T, Tr, Td, Ti, Tn, Tc), but before any other property setting or command is applied; if there are no <<matchByVal>>'s (i.e., "U*":{}), all items are selected	Ex: {"U*":{},"tag":["critical"]} sets tag of all items in root to "critical"
<<Command>>	"!updateDeep":{(<<matchByVal>>(,<<matchByVal>>)*)?}	"U\*\*":{(<<matchByVal>>(,<<matchByVal>>)*)?}	Update multiple descendants of current container, recursively; this <<Command>> is only valid for container-type items; select all items that match all <<matchByVal>>'s in current container and all its children, recursively, and update them according to current property specifications; update commands are processed in the following order: "U", then "U**", then "U*", and these are processed after scheduling commands (T, Tr, Td, Ti, Tn, Tc), but before any other property setting or command is applied; if there are no <<matchByVal>>'s (i.e., "U**":{}), all items are selected	Ex: {"U**":{},"tag":["critical"]} sets tag of all items in display to "critical"; Ex: {"U":"My numbers","U**":{"c":"num"},"tag":["critical"]} sets tag of all numeric items in "My numbers" container or any of its descendant containers to "critical"
<<uiDirective>>	"!~open":"<<url>>"	"open":"<<url>>"	open (or download) external resource	Ex: {"!~open":"https://google.com"} will open google website in a separate window; Ex: {"!~open":"https://reqres.in/api/users","fmt":"json"} will download sample json data from reqres.in website
<<uiDirective>>	"!~save":[<<text>>,<<text>>]	"save":[<<text>>,<<text>>]	save text/data to user's local file; the first <<text>> parameter is the filename, and the second is the text/data to be saved	Ex: APP->UI message {"!~save":["hello.txt","hello world"]} will cause UI software to open a prompt to save a text file hello.txt, whose content will be "hello world"
<<uiDirective>>	"!~save":[<<text>>,<<text>>,"base64"]	"save":[<<text>>,<<text>>,"base64"]	save binary data to user's local file; the first <<text>> parameter is the filename, and the second is the base64-encoded binary data to be saved; UI software will decode data from base64 to binary before saving to a file	Ex: APP->UI message {"!~save":["hello.txt","aGVsbG8gd29ybGQ="]} will cause UI software to open a prompt to save a file hello.txt, whose content will be "hello world"
<<Command>>	"!~loading":1|0	"loading":1|0	"!~loading":1 shows a wait/loading modal on top of the current container (usually semi-transparent), preventing interaction with all items in this container; "!~loading":0 (or "!~loading":null) removes the loading modal, re-enabling interaction with display	
<<Command>>	"!~move":<<uid>>	"M":<<uid>>	Move item from its current parent to container specified by <<uid>>; <<Command>> "M" is always processed before <<property>> "i"	Ex: APP->UI message {"A":[{"id":"A","v":["a","b"]},{"id":"B","v":[]}],"Q":[{"U":["A",1],"M":"B"}]} will add containers A and B to display, where container A has text "a" and "b" inside, and B has nothing, and then move second item from A into B, resulting in the following UIOM: {"v":[{"c":"bin","id":"A","v":[{"c":"txt","v":"a"}]},{"c":"bin","id":"B","v":[{"c":"txt","v":"b"}]}]}
<<Command>>	"~addTags":[<<tag>>(,<<tag>>)*]	"Atag":[<<tag>>(,<<tag>>)*]	Add tags to item's "tag" <<property>>; each <<tag>> indicates the item is semantically [and thus visually] distinct from items that do not share this <<tag>>; if <<tag>> is not already in this item's "tag" <<property>>, it is added; if this item has no "tag" <<property>> or "tag" is an empty-list, then "Atag":[<<tag>>(,<<tag>>)*] is equivalent to "tag":[<<tag>>(,<<tag>>)*]; if <<property>> "tag" and <<Command>> "Atag" are in the same <<pList>>, "tag" is processed before "Atag"	
<<Command>>	"~properties":{<<propName>>:<<values>>(,<<propName>>:<<values>>)*}	"<-":{<<propName>>:<<values>>(,<<propName>>:<<values>>)*}	assign property values in a series; for container-type items only; each <<value>> in <<values>> gets assigned to this container's respective child's <<propName>> property; if <<property>> "v" or <<Command>> "A" are in the same <<pList>> as <<Command>> "<-", "<-" is processed after both "v" and "A"	Ex: APP->UI message {"A":[{"c":"data","plt":"xy","v":[3,5,7,1],"<-":{"x":[0.5,2.1,3.2,4.5]}}]} is equivalent to APP->UI message {"A":[{"c":"data","plt":"xy","v":[{"v":3,"x":0.5},{"v":5,"x":2.1},{"v":7,"x":3.2},{"v":1,"x":4.5}]}]}
<<Command>>	"~request":[(<<req>>(,<<req>>)*)?]	"R":[(<<req>>(,<<req>>)*)?]	Request info; [(<<req>>(,<<req>>)*)?] describes the information to be sent back to application software; if no specific information is requested (i.e., "R":[]), a message with <<userProp>> "r" is still returned (e.g., APP->UI message {"R":[]} will be ensued by UI->APP message {"t":<<ums>>,"r":{}}); for items that have children, <<req>> "v" returns the child array in accordance with the display object-model (e.g., APP->UI message {"v":["hello",12],"R":["v"]} will be ensued by UI->APP message {"t":<<ums>>,"r":{"v":[{"c":"txt","v":"hello"},{"c":"num","v":12}]}}); if <<req>> information is unavailable, the UI->APP message must include <<req>>:null for the corresponding <<req>> (i.e., every requested <<req>> text must be included as a key in the ensuing UI->APP message, even if it's not a known name of a property); "R" command is executed after all other commands/properties in current <<pList>>, but before "Q" ("Q" is always processed last)	Ex: APP->UI message {"v":[{"id":"hello","v":"world","tag":["s1"],"R":["v","tag","wh","__foobar"]}]} will cause "hello":"world" text item to be added to display, and immediately after will send UI->APP message {"t":<<ums>>,"u":"hello","r":{"v":"world","tag":["s1"],"wh":[<<number>>,<<number>>],"__foobar":null}}
<<Command>>	<<eventInfo>>		simulate a user-generated event; this is useful for triggering updates bound to a "!trigger" or, in the case where <<eventInfo>> is "ctx":[(<<xy>>)?], for bringing up a <<contextMenu>> for items that have "onContext":<<contextMenu>> property	
<<itemClass>>	"hold"		this item is a hold-down button -- a special <<boolean>> that sends <<userProp>> "v":true when pressed and "v":false when released	
<<itemClass>>	"opt"		this item is a selectable option -- a special <<boolean>> that can be selected (setting <<property>> "v" to true) and deselected (setting <<property>> "v" to false) with alternating clicks	
<<itemClass>>	"time"		this item is a timespan field -- a special <<number>> item whose value represents a number of seconds; use <<numProp>> "step" to control time precision (e.g., use "step":60 to exclude seconds or "step":1 to exclude milliseconds)	Ex: APP->UI message {"A":[{"c":"time","v":12345.67}]} adds the time 3:25:45.670 to the display
<<itemClass>>	"dt"		this item is a datetime field -- a special <<number>> item whose value represents number of seconds since epoch; default value for this item is current datetime (e.g., an APP->UI message {"A":[{"c":"dt"}]} received on 04/08/2021 at 07:11:23.364 PM (localtime) will be instantiated with the value 1617909083.364, thus displaying date/time 2021-04-08 07:11:23.364 PM); use <<numProp>> "step" to control datetime precision (e.g., use "step":60 to exclude seconds, "step":86400 to exclude time (just show the date), or "step":1 to exclude milliseconds); use <<numProp>> "unit" to provide context for current timestamp (e.g., timezone)	Ex: APP->UI message {"A":[{"c":"dt","v":1613135520,"step":60,"unit":"UTC-05:00"}]} adds the date/time 2021-12-12 1:12pm UTC-05:00 to the display
<<itemClass>>	"math"		this item is a mathematical value or formula -- a special <<text>> item that follows AsciiMath syntax (see http://asciimath.org/ for more detail); use "i" (character i in double-quotes) or UTF character ⅈ to denote imaginary number (i.e., square root of -1)	Ex: APP->UI message {"A":[{"c":"math","id":"Special Relativity","v":"E=mc^2"}]} adds a math formula to display title Special Relativity, with the value "E=mc²"; Ex: APP->UI message {"A":[{"id":"Number Examples","v":[{"id":"whole","v":1},{"id":"real","v":1.1},{"c":"math","id":"fraction","v":"1/2"},{"c":"math","id":"complex","v":"(2+3\"i\")"},{"c":"math","id":"constant","v":"pi"}]}]},{"c":"math","id":"infinity","v":"oo"}]}]} will add a Number Examples bin to display, containing examples of whole, real, fraction, complex number, a mathematical constant, and infinity
<<itemClass>>	"doc"		this item is an embedded document - its a special <<text>> item that includes markup syntax; default markup language is HTML (use "fmt" property for alternate behavior; for example "fmt":"md" signifies this doc uses markdown syntax); this should only be employed for displaying documents, not functional UI components, and with the assumption that many machine agents will ignore markup tags	Ex: APP->UI message {"A":[{"c":"doc","v":"<b>this text is bold</b>"}]} will add bold text "this text is bold" to display; Ex: APP->UI message {"A":[{"c":"doc","fmt":"md","v":"_this text is underlined_"}]} will add underlined text "this text is underlined" to display
<<itemClass>>	"file"		this item is a file chooser - its a special <<text>> item whose "input" property is 1 by default (i.e., interactive by default), and whose value is set after user chooses some file(s); by default file-chooser only allows choosing a single file, and after the user chooses a file from their storage device a UI->APP message {"t":<<ums>>,"u":<<uid>>,"v":<<base64>>} is sent, where <<base64>> is the base64 representation of file contents (for alternate behavior, see <<fileProp>> "accepts"); if <<interactProp>> "go":1 is used for this item, the UI->APP message with file contents is not sent until after the "go" button is clicked	
<<itemClass>>	"rgb"		this item is a color -- a special <<text>> item whose value is a 6-character hexadecimal value, representing RGB color; for human users this is likely displayed as the actual color, rather than a hex string	Ex: APP->UI message {"A":[{"c":"rgb","v":"40e0d0","in":1}]} will add a color picker to display, with its current value set to turquoise
<<itemClass>>	"drop"		this item is a dropdown container (usually a dropdown menu) -- a special <<container>> whose content is folded by default (i.e., "fold":2), and when it is unfolded (i.e., "fold":1) it is drawn hovering above other content, and is automatically folded again when this item loses focus or when one of its inputs is edited or toggled; this item cannot have "fold":0 property -- its "fold" property is always 1 or 2; every item inside a "drop" container is a button (i.e., "Class":"btn") by default (use "defaults" property for alternate behavior)	Ex: {"A":[{"id":"File","c":"drop","v":[{"id":"Open"},{"id":"Save","in":0},"",{"id":"Recent","c":"drop","v":[{"id":"File 1"},{"id":"File 2"}]}]}]} adds a clickable "File" item to display, and whenever "File" is clicked, a menu is shown with a clickable "Open" button, a disabled "Save" button, a spacer, and a "Recent" submenu with clickable items "File 1" and "File 2"
<<itemClass>>	"ctx"		this item is a context menu -- a special <<container>> that is drawn hovering above other content, and is automatically deleted from display when this item loses focus or when one of its inputs is edited or toggled; every item inside a "ctx" container is a button (i.e., "Class":"btn") by default (use "defaults" property for alternate behavior); if "ctx" item is destroyed as a result of losing focus, a UI->APP message {"t":<<ums>>,"u":<<uid>>,"v":null} is sent	Ex: {"A":[{"id":"my text","v":"hello world"},{"id":"copy-paste","c":"ctx","ref":"my text","v":[{"id":"Copy"},{"id":"Paste"}]}]} adds the text "hello world" to display, as well as a context menu (with buttons Copy, Paste) drawn aligned to the "hello world" text, and Copy or Paste buttons are clicked or user clicks elsewhere on screen, the context menu is deleted from display (sending UI->APP message {"t":<<ums>>,"u":"copy-paste","v":null} if the context menu was destroyed as a result of losing focus)	
<<itemClass>>	"win"		this item is a window/popup -- a special <<container>> that floats freely in its parent container (potentially obscuring view of what's behind it); "win" container position does not cause reflow of its siblings; by default "win" containers do not block interaction with other visible items on display (see "mod" <<winProp>> for alternate behavior); "win" container is able to receive focus (e.g. when it or one of its child items is clicked), and when it does this "win" container's stack-order index (<<property>> "i") is automatically increased maximally (i.e., it becomes last item in its parent container, and thus the top-most item, unobscured by other items); use <<interactProp>> "on":{"fcs":[]} to subscribe to "win" focus in/out events; when this container has no "mod":1 <<winProp>>, human-facing UI software is responsible for enabling interaction with sibling items that may be obscured by this container (this may be done by making "win" item draggable/resizable, via a keyboard shortcut or a toolbar, and/or any other method)	Ex: APP->UI message {"A":[{"c":"win","mod":1,"ds":1,"v":["This is a popup!"]}]} will display a modal (i.e., disabling interactions with other items) popup above all other content, the popup will have "This is a popup!" text inside, and a button to dismiss the popup
<<itemClass>>	"one"		this item is a container with one child whose content is visible and other children whose content is hidden (usually represented to humans as tabs, accordion, or a carousel) -- a special <<container>> whose children are all "bin" class items with <<containerProp>> "fold", where one child has <<containerProp>> "fold":1 and the rest of the children have <<containerProp>> "fold":2; by default the first "one" child has <<containerProp>> "fold":1 and the rest of the children have <<containerProp>> "fold":2; setting any "one" child <<containerProp>> "fold":1 will automatically set the rest of the children to "fold":2; user does not have the control to set "fold":2 for any "one" child (cannot hide a visible child), but can set "fold":1 (can show a specific child, thus automatically hiding other children); no UI->APP message is sent when a container in "one" is folded/unfolded (use <<interactProp>> "on":{"fold":[1]} to subscribe to unfold events for each child of "one")	Ex: APP->UI message {"A":[{"c":"one","df":{"on":{"fold":[1]}},"v":[{"id":"A","v":["hello"]},{"id":"B","v":["world"]}]}]} will add a container with two tabs to display, with item "A" being visible (displaying text "hello"), and if the user clicks on the second tab, item "B" will show (displaying text "world")
<<itemClass>>	"grid"		this item is a grid/table -- a special <<container>> that contains only "bin" class items, each of which will be a row in the grid; grid cells cannot be "win" class; null <<item>> declarations in the middle of grid-row <<container>> array declarations do *NOT* create empty grid cells -- these are ignored (just as they would be for any "bin" class items); deleting an item from a grid-row shifts the rest of row contents left to take up the space of the deleted item; each grid-row "id" or "cap" option is used as row header; human-facing UI software may include special visualization for grid (header row/col may be frozen, while other rows/cols are scrollable; if two consecutive header cells are identical, those header cells may be merged; etc.)	Ex: APP->UI message {"A":[{"c":"grid","id":"personnel","v":[["john",39,"m"],["mary",28,"f"]],"head":["name","age","gender"]}]} will add a "personnel" table with a header row and two records (john, mary) to display
<<itemClass>>	"<span"		this item is a grid cell merged with a cell to its left -- a special blank item inside a grid row, indicating that an item directly to its left spans rightward into this cell's space; this item has no working <<property>>'s	
<<itemClass>>	"^span"		this item is a grid cell merged with a cell above it -- a special blank item inside a grid row, indicating that an item directly above it spans downward into this cell's space; this item has no working <<property>>'s	
<<itemClass>>	"url"		this item is a frame displaying external resources -- an item whose value property must be "<<url>>", where the <<url>> points to a resource that will be displayed as an inline frame; <<interactProp>> "in":-1 disables user interactions with frame contents	Ex: APP->UI message {"A":[{"c":"url","v":"/images/image1.jpg"},{"c":"url","v":"https://google.com"}]} will add an image /images/image1.jpg and a frame displaying google.com website to display
<<itemClass>>	"media"		this item is embedded playable media (i.e., audio/video/slideshow) -- an item whose value must be "<<url>>", where <<url>> points to a media resource with playback capabilities; by default this item is interactive (subscribe to <<event>> "play", "at", and "av" to listen for media interaction events); <<interactProp>> "in":-1 disables user interactions with the specified media (i.e., app software may still start/end playback, but user-software cannot)	Ex: APP->UI message {"A":[{"c":"media","v":"/video/v1.mp4","play":1,"in":-1}]} will add a non-interactive playing video to display
<<itemClass>>	"plot"		this item is a 2d plot/chart -- a special <<container>> that contains only "data" class items; there is no need to specify "c":"data" for each item inside "plot", as this is presumed by UI software; all "data" series in this container will be drawn on the same plot and will share this item's "axisx" and "axisy" properties	
<<itemClass>>	"data"		this item is a series of data points -- a special <<container>> that contains only "dp" class items; there is no need to specify "c":"dp" for each item inside "data", as this is presumed by UI software	
<<itemClass>>	"dp"		this item is a data point on a chart -- a terminating numeric item inside each "data" container; this item is ignored if used outside of "data" containers	
<<itemClass>>	"2d"		this item is a 2d graphics viewport -- a special <<container>> whose children are "gr" items; there's no need to specify "c":"gr" for children of "2d" (because "gr" is the default and only component class for any child of "2d")	
<<itemClass>>	"3d"		this item is a 3d graphics viewport -- a special <<container>> whose children are "gr" items; there's no need to specify "c":"gr" for children of "3d" (because "gr" is the default and only component class for any child of "3d")	
<<itemClass>>	"grg"		this item is a group of graphical items -- a special <<container>> whose children are "grg" or "gr"; "grg" is not meant to be drawn on display, only its descendant "gr" and "l" items are drawn, thus all normally visualizable and interactive item properties ("cap", "ef", "af", "tag", "tip", "ctx", "ref", and <<interactProp>>'s) are ignored for "grg" container; there's no need to specify "c":"gr" for children of "grg" (because "gr" is the default component class for any item inside "grg"); for descendants of "2d", later "grg" containers (i.e., those with a higher index property "i") are drawn later, and are drawn on top of earlier-specified "grg" containers (i.e., those with a lower index property "i"); items inside "grg" should use coordinates relative to the "x"/"y" of this "grg" item; "x"/"y" properties of "grg" indicate the translation of this group, as well as the origin point for rotation and scaling	
<<itemClass>>	"gr"		this a graphical node inside a 2d or 3d container -- a special <<container>> that contains only "l" items (i.e., links); this item must be a child of "2d" or "3d" or "grg" container; each child of "gr" is a link to another "gr" item within this "2d" or "3d" container; there is no need to specify "c":"l" for children of "gr" (because "l" is the default and only class type allowed inside the "gr" container); use <<property>> "tag" to provide visual styling for "gr" items (e.g., background color, sprite images); for descendants of "2d", later "gr" items are drawn later, and are thus shown in front of earlier-specified "gr" items within the same "grg"	
